{
  "id": "elevenlabs",
  "label": "ElevenLabs",
  "source": "repo://presets.json#elevenlabs (dev-verified 2026-07-06; re-author from primary docs)",
  "mcp": {
    "transport": "stdio",
    "command": "uvx elevenlabs-mcp"
  },
  "methods": [
    {
      "key": "api-key",
      "kind": "apiKey",
      "name": "Paste an API key",
      "rank": 1,
      "inputs": [
        {
          "key": "ELEVENLABS_API_KEY",
          "label": "Elevenlabs API Key",
          "secret": true,
          "required": true
        }
      ]
    },
    {
      "key": "cli-owned",
      "kind": "cliOwned",
      "name": "Let Claude Code sign in itself (advanced)",
      "rank": 90
    }
  ],
  "grantCopy": "Voice generation on your ElevenLabs key (env pointer) — characters bill to you.",
  "verifiedAt": "2026-07-06"
}
