{
  "id": "cf-browser",
  "label": "Cloudflare Browser Rendering",
  "source": "repo://presets.json#cf-browser (dev-verified 2026-07-15; re-author from primary docs)",
  "group": "cloudflare",
  "mcp": {
    "transport": "http",
    "url": "https://browser.mcp.cloudflare.com/mcp"
  },
  "methods": [
    {
      "key": "browser",
      "kind": "oauth",
      "name": "Sign in with your browser",
      "rank": 1,
      "endpoints": {
        "discovery": "mcp"
      }
    },
    {
      "key": "cli-owned",
      "kind": "cliOwned",
      "name": "Let Claude Code sign in itself (advanced)",
      "rank": 90
    }
  ],
  "grantCopy": "Fetch and render pages, take screenshots - billed to your account.",
  "verifiedAt": "2026-07-15"
}
