{
  "id": "paypal",
  "label": "PayPal",
  "source": "repo://presets.json#paypal (dev-verified 2026-07-15; re-author from primary docs)",
  "mcp": {
    "transport": "http",
    "url": "https://mcp.paypal.com/mcp"
  },
  "methods": [
    {
      "key": "browser",
      "kind": "oauth",
      "name": "Sign in with your browser",
      "rank": 1,
      "endpoints": {
        "discovery": "mcp"
      }
    },
    {
      "key": "cli-owned",
      "kind": "cliOwned",
      "name": "Let Claude Code sign in itself (advanced)",
      "rank": 90
    }
  ],
  "grantCopy": "MONEY: invoices, payments, and payouts your PayPal account can move. A prompt-injected agent is a real financial risk - one trusted workspace at most, watch the trail.",
  "verifiedAt": "2026-07-15"
}
