{
  "id": "asana",
  "label": "Asana",
  "source": "repo://presets.json#asana (dev-verified 2026-07-15; re-author from primary docs)",
  "mcp": {
    "transport": "http",
    "url": "https://mcp.asana.com/sse"
  },
  "methods": [
    {
      "key": "browser",
      "kind": "oauth",
      "name": "Sign in with your browser",
      "rank": 1,
      "endpoints": {
        "discovery": "mcp"
      }
    },
    {
      "key": "cli-owned",
      "kind": "cliOwned",
      "name": "Let Claude Code sign in itself (advanced)",
      "rank": 90
    }
  ],
  "grantCopy": "Tasks and projects your account can reach - agents update real work items.",
  "verifiedAt": "2026-07-15"
}
