{
  "id": "make",
  "label": "Make.com",
  "source": "repo://presets.json#make (dev-verified 2026-07-05; re-author from primary docs)",
  "mcp": {
    "transport": "http",
    "url": "https://YOUR-MAKE-MCP-TOKEN-URL"
  },
  "methods": [
    {
      "key": "api-key",
      "kind": "apiKey",
      "name": "Paste an API key",
      "rank": 1,
      "connectionConfig": [
        {
          "key": "baseUrl",
          "label": "Instance URL",
          "help": "Self-hosted? Paste your instance address.",
          "required": true
        }
      ]
    },
    {
      "key": "cli-owned",
      "kind": "cliOwned",
      "name": "Let Claude Code sign in itself (advanced)",
      "rank": 90
    }
  ],
  "grantCopy": "Your Make scenarios as agent tools — 3,000+ apps of transitive reach. An agent that can run a scenario can do what the scenario does.",
  "verifiedAt": "2026-07-05"
}
