{
  "id": "postman",
  "label": "Postman",
  "source": "repo://presets.json#postman (dev-verified 2026-07-15; re-author from primary docs)",
  "mcp": {
    "transport": "http",
    "url": "https://mcp.postman.com/mcp"
  },
  "methods": [
    {
      "key": "browser",
      "kind": "oauth",
      "name": "Sign in with your browser",
      "rank": 1,
      "endpoints": {
        "discovery": "mcp"
      }
    },
    {
      "key": "cli-owned",
      "kind": "cliOwned",
      "name": "Let Claude Code sign in itself (advanced)",
      "rank": 90
    }
  ],
  "grantCopy": "Collections and APIs from your Postman workspaces.",
  "verifiedAt": "2026-07-15"
}
