{
  "id": "globalping",
  "label": "Globalping",
  "source": "repo://presets.json#globalping (dev-verified 2026-07-15; re-author from primary docs)",
  "mcp": {
    "transport": "http",
    "url": "https://mcp.globalping.dev/mcp"
  },
  "methods": [
    {
      "key": "browser",
      "kind": "oauth",
      "name": "Sign in with your browser",
      "rank": 1,
      "endpoints": {
        "discovery": "mcp"
      }
    },
    {
      "key": "cli-owned",
      "kind": "cliOwned",
      "name": "Let Claude Code sign in itself (advanced)",
      "rank": 90
    }
  ],
  "grantCopy": "Network measurements (ping, traceroute, DNS) from probes worldwide, on your account’s quota.",
  "verifiedAt": "2026-07-15"
}
